{
  "$schema": "../schemas/lesson.schema.json",
  "id": "lesson:template-tutorial",
  "title": "[TEMPLATE] Tutorial Lesson",
  "description": "Template for creating hands-on tutorial lessons",
  "type": "tutorial",
  "estimatedMinutes": 30,
  "content": {
    "format": "markdown",
    "body": "# Lesson Title\n\n## Learning Objectives\n- Objective 1\n- Objective 2\n- Objective 3\n\n## Introduction\n[Brief introduction to the topic]\n\n## Core Concepts\n### Concept 1\n[Explanation with examples]\n\n### Concept 2\n[Explanation with examples]\n\n## Hands-On Tutorial\n[Step-by-step instructions]\n\n## Summary\n[Key takeaways]\n\n## Next Steps\n[What to do next]",
    "resources": [
      {
        "title": "Reference Documentation",
        "url": "https://example.com/docs",
        "type": "reference"
      }
    ]
  },
  "activities": [
    "activity:template-practice-exercise"
  ],
  "objectives": [
    "Understand the core concepts",
    "Apply concepts through practice",
    "Build confidence with hands-on work"
  ]
}
