{
  "$schema": "../schemas/lesson.schema.json",
  "id": "lesson:template-lab",
  "title": "[TEMPLATE] Lab Lesson",
  "description": "Template for creating hands-on lab lessons",
  "type": "lab",
  "estimatedMinutes": 60,
  "content": {
    "format": "markdown",
    "body": "# Lab: [Topic]\n\n## Objectives\nBy the end of this lab, you will be able to:\n- [ ] Objective 1\n- [ ] Objective 2\n- [ ] Objective 3\n\n## Prerequisites\n- Tool/software requirements\n- Knowledge requirements\n- Access requirements\n\n## Setup\n### Step 1: Environment Setup\n[Instructions for setting up the lab environment]\n\n### Step 2: Download Materials\n[Any files or resources needed]\n\n## Lab Exercises\n\n### Exercise 1: [Title]\n**Goal:** [What you'll accomplish]\n\n**Steps:**\n1. [Step 1]\n2. [Step 2]\n3. [Step 3]\n\n**Expected Result:** [What should happen]\n\n**Checkpoint:** [How to verify success]\n\n### Exercise 2: [Title]\n**Goal:** [What you'll accomplish]\n\n**Steps:**\n1. [Step 1]\n2. [Step 2]\n\n**Expected Result:** [What should happen]\n\n**Checkpoint:** [How to verify success]\n\n## Challenge Exercise (Optional)\n[Advanced exercise for those who want to go deeper]\n\n## Troubleshooting\n### Common Issues\n- **Issue:** [Description]\n  - **Solution:** [How to fix]\n\n## Lab Submission\n[What to submit and how]\n\n## Review & Reflection\n- What did you learn?\n- What was challenging?\n- How could you apply this?",
    "resources": [
      {
        "title": "Lab Materials",
        "url": "https://example.com/lab-materials",
        "type": "tool"
      }
    ]
  },
  "activities": [
    "activity:template-lab-submission"
  ],
  "objectives": [
    "Gain hands-on experience with [topic]",
    "Practice [skill] in a realistic environment",
    "Build confidence through guided practice"
  ]
}
